indId,themaId,displayEU,indCode,indShortName,indLongName,indUnit,indFilter,indURL,indPeriod,indDivider,indDescEn
0,0,1,"tec00021","Recettes publiques","Recettes totales des administrations publiques ","% du PIB","sector:S13","http://ec.europa.eu/eurostat/tgm/table.do?tab=table&tableSelection=1&labeling=labels&footnotes=yes&layout=time,geo,cat&language=en&pcode=tec00021&plugin=1","2014","","Cet indicateur présente les recettes totales des administrations publiques, exprimées en % du produit intérieur brut (PIB). Ces recettes correspondent aux revenus totaux perçus par les administrations publiques d’un État. <br>Les administrations publiques comprennent l’administration centrale, les administrations d’États fédérés, les administrations locales et les administrations de sécurité sociale."
1,0,1,"tec00023","Dépenses publiques","Dépenses totales des administrations publiques
 ","% du PIB","sector:S13","http://ec.europa.eu/eurostat/tgm/table.do?tab=table&tableSelection=1&labeling=labels&footnotes=yes&layout=time,geo,cat&language=en&pcode=tec00023&plugin=1","2014","","Cet indicateur présente les dépenses totales des administrations publiques, exprimées en % du produit intérieur brut (PIB). Ces dépenses correspondent aux montants totaux dépensés par les administrations publiques d’un État. <br>Les administrations publiques comprennent l’administration centrale, les administrations d’États fédérés, les administrations locales et les administrations de sécurité sociale."
2,0,1,"tec00114","PIB par habitant","PIB par habitant en standards de pouvoir d'achat (SPA)","Indice: UE28 = 100",,"http://ec.europa.eu/eurostat/tgm/table.do?tab=table&tableSelection=1&labeling=labels&footnotes=yes&language=en&pcode=tec00114&plugin=1 ","2014","","Cet indicateur présente le produit intérieur brut (PIB) par habitant, exprimé en standards de pouvoir d’achat (SPA), par rapport à la moyenne de l’Union européenne (UE28) qui est fixée à 100. <br>Le PIB est une mesure de l’activité économique, il est défini comme la valeur de tous les biens et services produits moins la valeur des biens et services utilisés pour leur production. Si l’indice d’un pays est supérieur à 100, le niveau du PIB par habitant de ce pays est supérieur à la moyenne de l’Union européenne et inversement. <br>Le SPA est une monnaie commune qui élimine les différences de niveaux de prix entre les pays, permettant des comparaisons significatives du PIB entre les pays. Ainsi, un SPA permet d’acheter le même volume de biens ou de services dans tous les pays. "
3,0,1,"tec00118","Taux d'inflation","Taux d'inflation","variation en % par rapport à l’année précédente",,"http://ec.europa.eu/eurostat/tgm/table.do?tab=table&tableSelection=1&labeling=labels&footnotes=yes&language=en&pcode=tec00118&plugin=1","2015","","Cet indicateur présente le taux d’inflation, c’est-à-dire la variation moyenne des prix (en %) d’une année sur l’autre. L’inflation désigne une augmentation du niveau général des prix des biens et des services. <br>Dans une économie, l’inflation se traduit par une dépréciation de la monnaie qui y a cours, dans la mesure où un même montant permet de se procurer moins de biens et de services qu’auparavant. L’inflation dans une économie est souvent calculée sur la base de la comparaison des variations de prix d’un panier défini de biens et de services au fil du temps. <br>Un taux d’inflation négatif indique une déflation, c’est-à-dire une baisse du niveau général des prix des biens et des services. La déflation se traduit par une appréciation de la monnaie.

"
4,0,1,"tps00180","Croissance de l'emploi","Croissance de l'emploi","variation en % de la totalité de la population occupant un emploi par rapport à l’année précédente","sex:T","http://ec.europa.eu/eurostat/tgm/table.do?tab=table&tableSelection=1&labeling=labels&footnotes=yes&layout=time,geo,cat&language=en&pcode=tps00180&plugin=1","2014","","Cet indicateur présente l’évolution (en %) d’une année sur l’autre du nombre total de personnes occupant un emploi dans un pays. <br>Les personnes occupant un emploi sont les personnes âgées de 15 ans et plus qui ont travaillé au moins une heure contre rémunération ou en vue d’un bénéfice ou d’un gain familial durant la semaine de référence ou qui n’ont pas travaillé pendant celle-ci, mais avaient un emploi ou une activité dont elles étaient temporairement absentes. Cet indicateur couvre les travailleurs salariés et indépendants."
5,0,1,"tsdde410","Dette publique","Dette brute des administrations publiques","% du PIB","unit:PC_GDP","http://ec.europa.eu/eurostat/tgm/table.do?tab=table&init=1&language=en&pcode=tsdde410&plugin=1","2014","","Cet indicateur présente la dette brute des administrations publiques, appelée également dette publique, exprimée en % du produit intérieur brut (PIB). <br>Il s’agit de la valeur nominale (faciale) de la dette brute totale en cours à la fin de l’année et consolidée entre les sous-secteurs des administrations et au sein de ceux-ci. Elle inclut l’encours des stocks de numéraire et des dépôts, les titres de créance et les prêts à la fin de la période de référence. <br>Les administrations publiques comprennent l’administration centrale, les administrations d’États fédérés, les administrations locales et les administrations de sécurité sociale."
6,0,1,"tec00127","Déficit/surplus public","Déficit/surplus associée du gouvernement","% du PIB",,"http://ec.europa.eu/eurostat/tgm/table.do?tab=table&init=1&language=en&pcode=tec00127&plugin=1","2014","","Cet indicateur présente le déficit/excédent des administrations publiques, exprimé en % du produit intérieur brut (PIB). <br>Il s’agit de la différence entre les recettes et les dépenses du secteur des administrations publiques. Si les dépenses sont plus élevées que les recettes, les administrations publiques enregistreront un déficit, tandis que si les recettes sont supérieures aux dépenses, elles enregistreront un excédent. <br>Les administrations publiques comprennent l’administration centrale, les administrations d’États fédérés, les administrations locales et les administrations de sécurité sociale. "
7,0,1,"nama_gdp_c","Investissement","Formation brute de capital fixe (investissements)","% du PIB","unit:PC_GDP|indic_na:P51","http://appsso.eurostat.ec.europa.eu/nui/show.do?query=BOOKMARK_DS-055480_QID_B99A1CE_UID_-3F171EB0&layout=TIME,C,X,0%3BGEO,L,Y,0%3BUNIT,L,Z,0%3BINDIC_NA,L,Z,1%3BINDICATORS,C,Z,2%3B&zSelection=DS-055480INDICATORS,OBS_FLAG%3BDS-055480UNIT,PC_GDP%3BDS-055480INDIC_NA,P51%3B&rankName1=UNIT_1_2_-1_2&rankName2=INDICATORS_1_2_-1_2&rankName3=INDIC-NA_1_2_-1_2&rankName4=TIME_1_0_0_0&rankName5=GEO_1_2_0_1&sortC=ASC_-1_FIRST&rStp=&cStp=&rDCh=&cDCh=&rDM=true&cDM=true&footnes=false&empty=false&wai=false&time_mode=NONE&time_most_recent=false&lang=EN&cfo=%23%23%23%2C%23%23%23.%23%23%23","2013","","Cet indicateur présente les investissements (également appelés «formation brute de capital fixe»), exprimés en% du produit intérieur brut (PIB). <br>Les investissements correspondent aux acquisitions (achats) moins cessions (ventes) d’actifs fixes corporels ou incorporels réalisées par les producteurs résidents. Les actifs fixes corporels (ou immobilisations corporelles) englobent notamment les machines et équipements, les véhicules, les logements et autres bâtiments, mais aussi d’autres actifs détenus ou cultivés, comme les animaux d’élevage et les vignobles. L’indicateur couvre également les actifs incorporels (ou immobilisations incorporelles), tels que les logiciels et les œuvres récréatives, littéraires ou artistiques originales."
8,0,1,"nama_10_co3_p3-1","Dépenses de consommation des ménages:  produits alimentaires et boissons non alcoolisées","Dépense de consommation des ménages:  Alimentation & boissons non alcoolisées","% des dépenses totales des ménages","coicop:CP01|unit:PC_TOT","http://appsso.eurostat.ec.europa.eu/nui/show.do?query=BOOKMARK_DS-423035_QID_2EF9B743_UID_-3F171EB0&layout=TIME,C,X,0%3BGEO,L,Y,0%3BUNIT,L,Z,0%3BCOICOP,L,Z,1%3BINDICATORS,C,Z,2%3B&zSelection=DS-423035INDICATORS,OBS_FLAG%3BDS-423035COICOP,TOTAL%3BDS-423035UNIT,CP_MEUR%3B&rankName1=UNIT_1_2_-1_2&rankName2=INDICATORS_1_2_-1_2&rankName3=COICOP_1_2_-1_2&rankName4=TIME_1_0_0_0&rankName5=GEO_1_2_0_1&sortC=ASC_-1_FIRST&rStp=&cStp=&rDCh=&cDCh=&rDM=true&cDM=true&footnes=false&empty=false&wai=false&time_mode=ROLLING&time_most_recent=true&lang=EN&cfo=%23%23%23%2C%23%23%23.%23%23%23","2014","","Cet indicateur présente les dépenses des ménages consacrées à l’achat de produits alimentaires et de boissons non alcoolisées, exprimées en % des dépenses totales des ménages. <br>Il se réfère à toutes les dépenses effectuées par une personne vivant seule ou par un groupe de personnes vivant ensemble dans un logement partagé et ayant des dépenses communes pour la satisfaction directe de leurs besoins individuels. Il couvre les achats effectués pour une consommation à domicile uniquement (et non dans un hôtel, un restaurant, un bar, un kiosque, etc.). Les produits alimentaires et boissons non alcoolisées comprennent le pain, la viande, les produits laitiers, les fruits et légumes, ainsi que le café, le thé, l’eau, les jus, etc."
9,0,1,"nama_10_co3_p3-2","Dépense de consommation des ménages: articles d’habillement et articles chaussants","Dépenses de consommation des ménages: articles d’habillement et articles chaussants","% des dépenses totales des ménages","coicop:CP03|unit:PC_TOT","http://appsso.eurostat.ec.europa.eu/nui/show.do?query=BOOKMARK_DS-423035_QID_20B7A07A_UID_-3F171EB0&layout=TIME,C,X,0%3BGEO,L,Y,0%3BUNIT,L,Z,0%3BCOICOP,L,Z,1%3BINDICATORS,C,Z,2%3B&zSelection=DS-423035INDICATORS,OBS_FLAG%3BDS-423035COICOP,CP03%3BDS-423035UNIT,PC_TOT%3B&rankName1=UNIT_1_2_-1_2&rankName2=INDICATORS_1_2_-1_2&rankName3=COICOP_1_2_-1_2&rankName4=TIME_1_0_0_0&rankName5=GEO_1_2_0_1&pprRK=FIRST&pprSO=PROTOCOL&ppcRK=FIRST&ppcSO=ASC&sortC=ASC_-1_FIRST&rStp=&cStp=&rDCh=&cDCh=&rDM=true&cDM=true&footnes=false&empty=false&","2014","","Cet indicateur présente les dépenses des ménages consacrées à l’achat d'articles d'habillement et d'articles chaussants, exprimées en % des dépenses totales des ménages. <br>Il se réfère à toutes les dépenses effectuées par une personne vivant seule ou par un groupe de personnes vivant ensemble dans un logement partagé et ayant des dépenses communes pour la satisfaction directe de leurs besoins individuels. Les articles d'habillement comprennent les vêtements pour la ville, le sport ou le travail, y compris, par exemple, les ceintures, chapeaux et accessoires pour la fabrication de vêtements, sont couverts également les services de nettoyage à sec et de réparation. Les articles chaussants englobent toutes les chaussures, y compris les chaussures de sport pouvant être portées tous les jours ou pour une activité de loisirs, sont inclus également les services de réparation."
10,1,0,"tps00001","Population","Population totale au 1er janvier","millions de personnes",,"http://ec.europa.eu/eurostat/tgm/table.do?tab=table&tableSelection=1&labeling=labels&footnotes=yes&language=en&pcode=tps00001&plugin=1","2015","1000000","Cet indicateur présente le nombre d’habitants d’un pays au 1er janvier (ou, dans certains cas, au 31 décembre de l’année précédente). La population est calculée soit à partir des données obtenues lors du dernier recensement, ajustées à l’aide des composantes de la variation de la population depuis ce dernier recensement, soit à partir des registres de population. "
10,1,0,"proj_13npms","Population in 2080","Population in 2080 (projected)","millions de personnes","age:TOTAL|sex:T","http://appsso.eurostat.ec.europa.eu/nui/show.do?query=BOOKMARK_DS-376628_QID_-751B0A69_UID_-3F171EB0&layout=TIME,C,X,0%3BGEO,L,Y,0%3BAGE,L,Z,0%3BSEX,L,Z,1%3BINDICATORS,C,Z,2%3B&zSelection=DS-376628SEX,T%3BDS-376628AGE,TOTAL%3BDS-376628INDICATORS,OBS_FLAG%3B&rankName1=SEX_1_2_-1_2&rankName2=AGE_1_2_-1_2&rankName3=INDICATORS_1_2_-1_2&rankName4=TIME_1_0_0_0&rankName5=GEO_1_2_0_1&sortC=ASC_-1_FIRST&rStp=&cStp=&rDCh=&cDCh=&rDM=true&cDM=true&footnes=false&empty=false&wai=false&time_mode=NONE&time_most_recent=false&lang=EN&cfo=%23%23%23,%23%23%23.%23%23%23","2080","1000000","Cet indicateur présente la taille probable de la population totale en 2080. <br>Il s’agit d’un scénario hypothétique visant à fournir des informations sur la taille et la structure d’âge probables de la population, s’appuyant sur des hypothèses concernant l’évolution future de la fécondité, de l’espérance de vie et de la migration."
10,1,1,"demo_pjanind-1","Âge médian de la population","Âge médian de la population totale","années","indic_de:MEDAGEPOP","http://appsso.eurostat.ec.europa.eu/nui/show.do?query=BOOKMARK_DS-054158_QID_-706348A0_UID_-3F171EB0&layout=TIME,C,X,0%3BGEO,L,Y,0%3BINDIC_DE,L,Z,0%3BINDICATORS,C,Z,1%3B&zSelection=DS-054158INDICATORS,OBS_FLAG%3BDS-054158INDIC_DE,MEDAGEPOP%3B&rankName1=INDIC-DE_1_2_-1_2&rankName2=INDICATORS_1_2_-1_2&rankName3=TIME_1_0_0_0&rankName4=GEO_1_2_0_1&sortC=ASC_-1_FIRST&rStp=&cStp=&rDCh=&cDCh=&rDM=true&cDM=true&footnes=false&empty=false&wai=false&time_mode=ROLLING&time_most_recent=true&lang=EN&cfo=%23%23%23%2C%23%23%23.%23%23%23","2014","1000000","Cet indicateur présente l’âge médian de la population totale. L’âge médian est la valeur divisant la population d’un pays en deux groupes égaux, la moitié des habitants étant donc plus jeune que cet âge et la seconde moitié plus âgée."
10,1,1,"demo_pjanind-2","Population âgée de 15 à 24 ans","Population âgée de 15 à 24 ans","% de la population totale","indic_de:PC_Y15_24","http://appsso.eurostat.ec.europa.eu/nui/show.do?query=BOOKMARK_DS-054158_QID_-831095D_UID_-3F171EB0&layout=TIME,C,X,0%3BGEO,L,Y,0%3BINDIC_DE,L,Z,0%3BINDICATORS,C,Z,1%3B&zSelection=DS-054158INDICATORS,OBS_FLAG%3BDS-054158INDIC_DE,MEDAGEPOP%3B&rankName1=INDIC-DE_1_2_-1_2&rankName2=INDICATORS_1_2_-1_2&rankName3=TIME_1_0_0_0&rankName4=GEO_1_2_0_1&sortC=ASC_-1_FIRST&rStp=&cStp=&rDCh=&cDCh=&rDM=true&cDM=true&footnes=false&empty=false&wai=false&time_mode=ROLLING&time_most_recent=true&lang=EN&cfo=%23%23%23%2C%23%23%23.%23%23%23","2014","","Cet indicateur présente la population âgée de 15 à 24 ans, exprimée en % de la population totale."
10,1,1,"tps00010","Population aged 80+","Population âgée de 80 ans et plus","% de la population totale",,"http://appsso.eurostat.ec.europa.eu/nui/show.do?query=BOOKMARK_DS-054158_QID_-6F333A14_UID_-3F171EB0&layout=TIME,C,X,0%3BGEO,L,Y,0%3BINDIC_DE,L,Z,0%3BINDICATORS,C,Z,1%3B&zSelection=DS-054158INDICATORS,OBS_FLAG%3BDS-054158INDIC_DE,PC_Y15_24%3B&rankName1=INDIC-DE_1_2_-1_2&rankName2=INDICATORS_1_2_-1_2&rankName3=TIME_1_0_0_0&rankName4=GEO_1_2_0_1&sortC=ASC_-1_FIRST&rStp=&cStp=&rDCh=&cDCh=&rDM=true&cDM=true&footnes=false&empty=false&wai=false&time_mode=ROLLING&time_most_recent=true&lang=EN&cfo=%23%23%23%2C%23%23%23.%23%23%23","2014","","Cet indicateur présente la population âgée de 80 ans et plus, exprimée en % de la population totale."
10,1,1,"tps00003","Densité de population ","Densité de population ","habitants par km2",,"http://ec.europa.eu/eurostat/tgm/table.do?tab=table&tableSelection=2&labeling=labels&footnotes=yes&layout=time,geo,cat&language=en&pcode=tps00003&plugin=1","2013","","Cet indicateur présente le nombre d’habitants par kilomètre carré. "
10,1,1,"tsdde220","Taux de fécondité","Taux de fécondité","nombre moyen d’enfants par femme",,"http://ec.europa.eu/eurostat/tgm/table.do?tab=table&tableSelection=1&labeling=labels&footnotes=yes&language=en&pcode=tsdde220&plugin=1","2013","","Cet indicateur présente le nombre moyen d’enfants vivants auxquels une femme donnerait naissance durant sa vie, si elle traversait ses années de procréation en se conformant aux taux de fécondité par âge mesurés lors d’une année donnée. <br>En l’absence de flux migratoires, un taux de fécondité de 2,1 est nécessaire pour maintenir constante la taille de la population. "
10,1,1,"tesem010","Taux d’emploi","Taux d’emploi","% de personnes occupées âgées de 20 à 64 ans ","sex:T","http://ec.europa.eu/eurostat/tgm/table.do?tab=table&init=1&plugin=1&pcode=tesem010&language=en","2014","","Cet indicateur présente le taux d’emploi des personnes âgées de 20 à 64 ans. Il s’agit de la proportion de personnes occupant un emploi âgées de 20 à 64 ans par rapport à la population totale du même groupe d’âge. <br>Les personnes occupant un emploi sont les personnes qui ont travaillé au moins une heure contre rémunération ou en vue d’un bénéfice ou d’un gain familial durant la semaine de référence ou qui n’ont pas travaillé pendant celle-ci, mais avaient un emploi ou une activité dont elles étaient temporairement absentes. Cet indicateur couvre les travailleurs salariés et indépendants. Il est mesuré selon la définition de l’Organisation internationale du travail (OIT). "
10,1,1,"tesem140","Taux de chômage des jeunes","Taux de chômage des jeunes","% de chômeurs de moins de 25 ans",,"http://ec.europa.eu/eurostat/tgm/table.do?tab=table&init=1&language=en&pcode=tesem140&plugin=1","2014","","Cet indicateur présente le taux de chômage des jeunes âgés de 15 à 24 ans. Il exprime le nombre de jeunes chômeurs en proportion (en %) de la population active du même âge. <br>Les chômeurs sont les personnes qui 1) étaient sans travail pendant la semaine de référence, mais sont actuellement disponibles pour travailler, et 2) étaient activement à la recherche d’un travail au cours des quatre semaines précédentes ou avaient déjà trouvé un emploi devant débuter dans les trois mois suivants. <br>La population active comprend les personnes occupées et les chômeurs. Cet indicateur est mesuré selon la définition de l’Organisation internationale du travail (OIT). "
10,1,1,"tsdde420","Durée de vie au travail","Durée de vie au travail","années","sex:T","http://ec.europa.eu/eurostat/tgm/refreshTableAction.do?tab=table&plugin=1&pcode=tsdde420&language=en","2014","","Cet indicateur présente le nombre d’années durant lesquelles une personne âgée de 15 ans devrait être active sur le marché du travail (c’est-à-dire en situation d’emploi) tout au long de sa vie."
10,1,1,"tps00012","Mariages","Taux de nuptialité (Nombre de mariages)","pour 1 000 personnes",,"http://ec.europa.eu/eurostat/tgm/table.do?tab=table&tableSelection=1&labeling=labels&footnotes=yes&language=en&pcode=tps00012&plugin=1","2013","","Cet indicateur présente le ratio entre le nombre de mariages et la population moyenne pour une année donnée. Il est exprimé pour 1 000 habitants. <br>Le mariage est l’acte, la cérémonie ou le processus par lequel la relation juridique entre deux époux est constituée. La légalité de l’union peut être établie par des moyens civils, religieux ou autres, en fonction des lois de chaque pays. "
10,1,1,"tps00013","Divorces","Taux de divorce","pour 1 000 personnes",,"http://ec.europa.eu/eurostat/tgm/table.do?tab=table&tableSelection=1&labeling=labels&footnotes=yes&language=en&pcode=tps00013&plugin=1","2012","","Cet indicateur présente le ratio entre le nombre de divorces et la population moyenne pour une année donnée. Il est exprimé pour 1 000 habitants. <br>Le divorce est la dissolution juridique définitive (fin) d’un mariage, conformément aux lois de chaque pays. Le divorce est autorisé dans tous les États membres de l’Union européenne. "
10,1,1,"tps00025-1","Espérance de vie: hommes","Espérance de vie à la naissance: hommes","années","sex:M","http://ec.europa.eu/eurostat/tgm/table.do?tab=table&tableSelection=2&labeling=labels&footnotes=yes&layout=time,geo,cat&language=en&pcode=tps00025&plugin=1","2013","","Cet indicateur présente le nombre moyen d’années qu’un nouveau-né de sexe masculin peut espérer vivre dans l’hypothèse d’un maintien des conditions actuelles de mortalité durant toute sa vie."
10,1,1,"tps00025-2","Espérance de vie: femmes","Espérance de vie à la naissance: femmes","années","sex:F","http://ec.europa.eu/eurostat/tgm/table.do?tab=table&tableSelection=3&labeling=labels&footnotes=yes&layout=time,geo,cat&language=en&pcode=tps00025&plugin=1","2013","","Cet indicateur présente le nombre moyen d’années qu’un nouveau-né de sexe féminin peut espérer vivre dans l’hypothèse d’un maintien des conditions actuelles de mortalité durant toute sa vie."
10,1,1,"tps00027","Mortalité infantile","Mortalité infantile ","pour 1 000 naissances vivantes",,"http://ec.europa.eu/eurostat/tgm/table.do?tab=table&tableSelection=1&labeling=labels&footnotes=yes&language=en&pcode=tps00027&plugin=1","2013","","Cet indicateur présente le rapport entre le nombre de décès d’enfants de moins d’un an et le nombre de naissances vivantes au cours de l’année de référence. Il est exprimé pour 1 000 naissances vivantes. "
10,1,1,"tsdpc510","Personnes par ménage","Nombre moyen de personnes par ménage","personnes",,"http://ec.europa.eu/eurostat/tgm/table.do?tab=table&tableSelection=1&labeling=labels&footnotes=yes&language=en&pcode=tsdpc510&plugin=1","2014","","L’indicateur présente le nombre moyen de personnes vivant dans des ménages privés. <br>Un ménage privé est une entité ayant des aménagements communs, partageant les dépenses ou les besoins quotidiens et vivant dans une résidence commune. "
10,1,1,"ilc_lvps08-1","Hommes vivant avec leurs parents","Hommes âgés de 18 à 34 ans vivant avec leurs parents","% de la population totale âgée de 18 à 34 ans ","sex:M|age:Y18-34","http://appsso.eurostat.ec.europa.eu/nui/show.do?query=BOOKMARK_DS-207342_QID_44320CBA_UID_-3F171EB0&layout=TIME,C,X,0%3BGEO,L,Y,0%3BSEX,L,Z,0%3BAGE,L,Z,1%3BINDICATORS,C,Z,2%3B&zSelection=DS-207342SEX,M%3BDS-207342AGE,Y18-34%3BDS-207342INDICATORS,OBS_FLAG%3B&rankName1=AGE_1_2_-1_2&rankName2=INDICATORS_1_2_-1_2&rankName3=SEX_1_2_-1_2&rankName4=TIME_1_0_0_0&rankName5=GEO_1_2_0_1&sortC=ASC_-1_FIRST&rStp=&cStp=&rDCh=&cDCh=&rDM=true&cDM=true&footnes=false&empty=false&wai=false&time_mode=ROLLING&time_most_recent=true&lang=EN&cfo=%23%23%23%2C%23%23%23.%23%23%23","2014","","Cet indicateur présente la proportion de jeunes hommes âgés de 18 à 34 ans vivant avec (un de) leurs parents dans un ménage commun, exprimée en % de la population totale du même groupe d’âge. "
10,1,1,"ilc_lvps08-2","Femmes vivant avec leurs parents","Femmes âgées de 18 à 34 ans vivant avec leurs parents","% de la population totale âgée de 18 à 34 ans ","sex:F|age:Y18-34","http://appsso.eurostat.ec.europa.eu/nui/show.do?query=BOOKMARK_DS-207342_QID_44AD0D15_UID_-3F171EB0&layout=TIME,C,X,0%3BGEO,L,Y,0%3BSEX,L,Z,0%3BAGE,L,Z,1%3BINDICATORS,C,Z,2%3B&zSelection=DS-207342SEX,M%3BDS-207342AGE,Y18-34%3BDS-207342INDICATORS,OBS_FLAG%3B&rankName1=AGE_1_2_-1_2&rankName2=INDICATORS_1_2_-1_2&rankName3=SEX_1_2_-1_2&rankName4=TIME_1_0_0_0&rankName5=GEO_1_2_0_1&sortC=ASC_-1_FIRST&rStp=&cStp=&rDCh=&cDCh=&rDM=true&cDM=true&footnes=false&empty=false&wai=false&time_mode=ROLLING&time_most_recent=true&lang=EN&cfo=%23%23%23%2C%23%23%23.%23%23%23","2014","","Cet indicateur présente la proportion de jeunes femmes âgées de 18 à 34 ans vivant avec (un de) leurs parents dans un ménage commun, exprimée en % de la population totale du même groupe d’âge. "
10,1,0,"tps00191","Demandeurs d’asile","Demandeurs d’asile","milliers de personnes","asyl_app:ASY_APP","http://ec.europa.eu/eurostat/tgm/refreshTableAction.do?tab=table&plugin=1&pcode=tps00191&language=en","2014","1000","Cet indicateur présente le nombre total de demandeurs d’asile au cours de l’année concernée. <br>On entend par «demandeur d’asile» toute personne qui a déposé une demande de protection internationale ou qui a été incluse dans une telle demande en tant que membre de la famille au cours de la période de référence. Le terme «demande de protection internationale» couvre toute demande de protection internationale, indépendamment du fait que celle-ci ait été introduite lors de l’arrivée à la frontière ou une fois à l’intérieur du pays et indépendamment du fait que la personne ait pénétré sur le territoire légalement (par exemple en tant que touriste) ou illégalement."
10,1,1,"educ_ipart_s","Étudiants","Étudiants de l’enseignement supérieur âgés de 20 à 24 ans ","% de la population totale âgée de 20 à 24 ans","indic_ed:PS03_10|sex:T","http://appsso.eurostat.ec.europa.eu/nui/show.do?query=BOOKMARK_DS-063179_QID_6E6F81C6_UID_-3F171EB0&layout=TIME,C,X,0%3BGEO,L,Y,0%3BINDIC_ED,L,Z,0%3BSEX,L,Z,1%3BINDICATORS,C,Z,2%3B&zSelection=DS-063179SEX,T%3BDS-063179INDIC_ED,PS03_10%3BDS-063179INDICATORS,OBS_FLAG%3B&rankName1=INDIC-ED_1_2_-1_2&rankName2=INDICATORS_1_2_-1_2&rankName3=SEX_1_2_-1_2&rankName4=TIME_1_0_0_0&rankName5=GEO_1_2_0_1&sortC=ASC_-1_FIRST&rStp=&cStp=&rDCh=&cDCh=&rDM=true&cDM=true&footnes=false&empty=false&wai=false&time_mode=ROLLING&time_most_recent=true&lang=EN&cfo=%23%23%23%2C%23%23%23.%23%23%23","2012","","Cet indicateur présente le nombre d’étudiants âgés de 20 à 24 ans inscrits dans l’enseignement supérieur, exprimé en % de la population totale âgée de 20 à 24 ans. <br>L’enseignement supérieur comprend les programmes à orientation universitaire, qui sont en grande partie théoriques, et les programmes à orientation professionnelle, ainsi que les programmes qui conduisent à l’obtention d’un titre de chercheur hautement qualifié (doctorat ou Ph.D.). "
